{
  "schemaVersion": 1,
  "name": "通用决策示例",
  "instructions": "依据题干提供的事实和规则选择答案，不引入未给出的额外条件。",
  "questions": [
    {
      "id": "demo-1",
      "type": "single",
      "category": "客服分流",
      "question": "团队分工：账号团队处理密码与登录，订单团队处理发货与退款。用户说：我忘记密码，无法登录。应转交哪个团队？",
      "options": { "A": "账号团队", "B": "订单团队", "C": "不处理" },
      "answer": ["A"],
      "explanation": "忘记密码属于题干明确规定的账号团队职责。"
    },
    {
      "id": "demo-2",
      "type": "multiple",
      "category": "数据安全",
      "question": "发布规则：可以公开不含真实凭证的示例代码和模拟数据；真实 API Key 与客户个人信息不得公开。以下哪些内容可以加入公开仓库？",
      "options": { "A": "不含真实凭证的示例代码", "B": "真实 API Key", "C": "人工编写的模拟数据", "D": "客户手机号列表" },
      "answer": ["A", "C"],
      "explanation": "A 与 C 符合给定规则；B 与 D 被规则禁止公开。"
    },
    {
      "id": "demo-3",
      "type": "boolean",
      "category": "逻辑判断",
      "question": "已知：所有红色箱子都已检查；箱子甲是红色。因此，箱子甲已检查。这个结论成立。",
      "options": { "A": "正确", "B": "错误" },
      "answer": ["A"],
      "explanation": "箱子甲满足红色箱子的条件，结论可由给定规则直接推出。"
    }
  ]
}
